id,date,time,tweet
983910220412829696,2018-04-10,23:30:51,Goldman Sachs: Tesla EPS estimates (‘18 & ‘19) from 2014 vs now. $TSLA @TeslaCharts @ReformedBroker @MarkYusko pic.twitter.com/D9HORzY3AD
983910007484764161,2018-04-10,23:30:00,Tesla: Avoid at all Cost or Time to Invest.  https://goo.gl/9YFkaA  $TSLA #Investments #Investing #Tesla #Stock #FinancialEducation #InvestmentEducation pic.twitter.com/ejOW1Ju9Yt
983903243746017281,2018-04-10,23:03:08,Tesla jumps as investors shrug off China recall (TSLA) -   http://markets.businessinsider.com/news/1020961170 
983898780247449601,2018-04-10,22:45:23,"Reminder tesla “manufactures” > 100x as many lemons any other OEM, even low end, over 2000x as likely as Toyota. $TSLA knowingly sells lemons per whistleblower.  Tesla has you pick up car in a dark room- all you need to know.  And yes, you will need to sue, so can push off CF hit  https://twitter.com/ttarhan/status/983580015617961985 …"
983897363965194241,2018-04-10,22:39:46,Unreal. $TSLA man who died in recent crash complained to Tesla numerous times about AP problems. You have to be a nutjob to trust Elon and buy one of these POS cars.   http://abc7news.com/automotive/exclusive-wife-of-man-who-died-in-tesla-crash-gives-emotional-interview-to-i-team/3325177/ …
983896116931547136,2018-04-10,22:34:48,"""EXCLUSIVE: Wife of man who died in Tesla crash gives emotional interview""  http://abc7news.com/3325177/  MUSK IS A KILLER & THEY'RE SUING $TSLA. IF THIS GETS TO DISCOVERY IT'S GAME-OVER FOR THE COMPANY. WATCH TESLA TRY TO SETTLE THIS!"
983895135896338432,2018-04-10,22:30:54,"So, a 6 month interest fee loan after he requested it back? #bestpractices $tsla"
983893953434062850,2018-04-10,22:26:13,"$AMZN $FB $TSLA Cramer assesses the damage in Facebook, Tesla and Amazon's stocks after scandals  https://ift.tt/2qmbIsZ "
983893493096448001,2018-04-10,22:24:23,Rockets 🚀 breh! #Tesla $TSLA
983888253228146688,2018-04-10,22:03:33,"Tesla $TSLA Receiving Somewhat Favorable Press Coverage, Study Finds  http://registrarjournal.com/?p=504457 "
983887964467093504,2018-04-10,22:02:25,"Tesla $TSLA Receiving Somewhat Favorable Press Coverage, Study Finds  http://dakotafinancialnews.com/?p=28364 "
983887709386113025,2018-04-10,22:01:24,"I say any #tesla is x19 times uglier, best part is that it's a Mercedes, best in class quality, reliability and looks.. $TSLA $TSLAQ"
983887409313140737,2018-04-10,22:00:12,Tesla $TSLA Given News Sentiment Score of 0.02  http://zpr.io/n9myR 
983885325700186112,2018-04-10,21:51:56,$TSLA Great visual on how Tesla profitability if firmly a matter of future.  How many gullible analysts have been revising earnings targets down and stock price targets up since 2014 and still project profits for Tesla in the future?  https://twitter.com/TeslaCharts/status/983824538722021378 …
983883661757026304,2018-04-10,21:45:19,"In other news, Goldman throws shade at $TSLA, estimates it's far short of sustaining 2K Model 3s per week.  >> A pessimistic Tesla forecast    https://buff.ly/2IITUyU "
983878011534610432,2018-04-10,21:22:52,$TSLA Elon Musk calls out Goldman Sachs after negative report on Tesla: 'Place your bets'  https://www.cnbc.com/2018/04/10/elon-musk-calls-out-goldman-sachs-after-negative-report-on-tesla.html … $GS $SPY $GLD $SLV $DIA $DJIA $IWM $TLT $EEM #stockmarket #commodities #investing #finance #stocks #gold #silver #bonds
983875309719244801,2018-04-10,21:12:08,BP Selects Tesla As Supplier For New Energy Storage System At Titan 1 Wind Energy Installation  $GLD $XAUUSD $TSLA $BARC $LYG $JPM $C $GBTC $SQ $AMZN $COIN $aapl $spy $nflx $nvda $mu $OPEC $USD $JPY $USOIL $UKOIL https://cleantechnica.com/2018/04/10/bp-selects-tesla-as-supplier-for-new-energy-storage-system-at-titan-1-wind-energy-installation/ …
983874741856555010,2018-04-10,21:09:52,BP to Store Clean Power With #Tesla Battery at U.S. Wind Farm  $BP $TSLA  https://www.bloomberg.com/news/articles/2018-04-10/bp-to-store-clean-power-with-tesla-battery-at-u-s-wind-farm …
983854793264369664,2018-04-10,19:50:36,"Negative sentiment means BUY! TSLA UP +15.04 (+5.19%) today. So much for the arm chair experts who never invest just write bullsh't about good companies like Tesla and Herbalife. BTW, how did this work with $HLF? Shorts lost their shorts."
983853669199294464,2018-04-10,19:46:08,"I have, bought more TSLA at the last ""sale"". My bet is on you and Tesla. Keep up the good work, buddy."
983851122262794240,2018-04-10,19:36:01,$TSLA $NOC:  Elon Musk roundup: Tesla hashing out crash with NTSB… SpaceX …:   https://www.StockNewsWires.com/tsla-noc-elon-musk-roundup-tesla-hashing-out-crash-with-ntsb-spacex/ …
983848006838640640,2018-04-10,19:23:38,Tesla: A Few Thoughts on Ageing Products Before 2Q Earnings Announcement $TSLA #UnitedStates #ConsumerDiscretionary #bottomup #equities https://buff.ly/2Hoo8rn 
983847527974948865,2018-04-10,19:21:44,"Also an open question where Tesla finds space to make the Y one day. They could use both Fremont and Nevada - or a new factory. But that‘s not done overnight; and as you pointed out it takes billions to create (another) mass-market cars, even if they use Model3 as a start. $TSLA"
983846589381926914,2018-04-10,19:18:00,Tesla (TSLA) stock rises as China’s President opens door for factory ownership and lower import duties | Electrek  https://electrek.co/2018/04/10/tesla-tsla-stock-rise-china-factory-import-duties/ …
983841862820777984,2018-04-10,18:59:13,Tesla (TSLA) stock rises as China's President opens door for factory ownership and lower import duties  https://electrek.co/2018/04/10/tesla-tsla-stock-rise-china-factory-import-duties/ … via @FredericLambert
983841085033189376,2018-04-10,18:56:08,BP unit agrees to buy and install Tesla battery for U.S. wind farm $TSLA  https://research.tdameritrade.com/grid/public/markets/news/story.asp?docKey=1-SN20180410011130&cid=1-SN20180410011130-MIP …
983840419820855296,2018-04-10,18:53:29,"Cramer assesses the damage in Facebook, Tesla and Amazon's stocks after scandals $tsla too risky to invest In! $tsla  https://www.cnbc.com/2018/04/10/cramer-assesses-the-damage-in-facebook-tesla-and-amazons-stocks.html …"
983839039970336769,2018-04-10,18:48:00,super idea mr @GerberKawasaki ..i deleted my $fb along with @elonmusk @WhatsApp because our trust in the platform compromised #DeleteFacebook ..i feel always safe with @Tesla $tsla  https://twitter.com/GerberKawasaki/status/983838534258667521 …
983838901361106947,2018-04-10,18:47:27,"Cramer assesses the damage in Facebook, Tesla and Amazon's stocks after scandals $FB $TSLA $AMZN  https://cnb.cx/2Jwdj7r  @jimcramer @cnbc"
983837795889369088,2018-04-10,18:43:04,"$FB $TSLA $AMZN $FDX $UPS:  Cramer assesses the damage in Facebook, Tesla and Amazon’s …:   https://www.StockNewsWires.com/fb-tsla-amzn-fdx-ups-cramer-assesses-the-damage-in-facebook-tesla-and-amazons/ …"
983837009746767873,2018-04-10,18:39:56,Tesla: Avoid at all Cost or Time to Invest.  https://goo.gl/9YFkaA  $TSLA #Investments #Investing #Tesla #Stock #FinancialEducation #InvestmentEducation pic.twitter.com/S9X43OMbkj
983836136991752194,2018-04-10,18:36:28,Tesla (TSLA) stock rises as China’s President opens door for factory ownership and lower import duties  🚗🔋⚡️🤖☺️👍🏻 #EV #RoboCars  https://electrek.co/2018/04/10/tesla-tsla-stock-rise-china-factory-import-duties/ …
983835658849542144,2018-04-10,18:34:34,Zuck.....batteries.......tesla batteries.......OMG FB going to buy TSLA..
983833849363877888,2018-04-10,18:27:23,"Tesla has Supercharger stations all over the map, but the largest, most luxurious one sits in the middle of a folksy California town — take a look inside (TSLA)  https://buff.ly/2v2qUjE "
983833254766751744,2018-04-10,18:25:01,"Tesla has Supercharger stations all over the map, but the largest, most luxurious one sits in the middle of a folksy California town — take a look inside (TSLA)  https://buff.ly/2v2qUjE "
983833252661219329,2018-04-10,18:25:00,"#ElonMusk says exit at your risk to stockholders looking to sell their #TSLA stocks soon. The likes of #GoldmanSachs like to throw shade, but #Tesla is a household name with a loyal fan base and Musk knows his tribe.    https://www.cnbc.com/2018/04/10/elon-musk-calls-out-goldman-sachs-after-negative-report-on-tesla.html …"
983829555134844928,2018-04-10,18:10:19,"Tesla has Supercharger stations all over the map, but the largest, most luxurious one sits in the middle of a folksy California town — take a look inside (TSLA)  https://read.bi/2JpbaKy "
983829268491796480,2018-04-10,18:09:10,"Do legacy carmakers really want the #electricvehicle movement to succeed? Unlike what #Tesla is focused on, Big Auto's objectives are very troubling. Read here:  http://ow.ly/WPAH30jqmyO  $TSLA #TeslaMotors #Tesla #ElonMusk"
983828322718289920,2018-04-10,18:05:25,"10 Things To Know. Tesla has Supercharger stations all over the map, but the largest, most luxurious one sits in the middle of a folksy California town — take a look inside (TSLA)  https://ift.tt/2uRwc1r "
983827734974664704,2018-04-10,18:03:05,"Tesla has Supercharger stations all over the map, but the largest, most luxurious one sits in the middle of a folksy California town — take a look inside (TSLA)  https://ift.tt/2uRwc1r "
983827688203931648,2018-04-10,18:02:54,"Tesla has Supercharger stations all over the map, but the largest, most luxurious one sits in the middle of a folksy California town — take a look inside (TSLA)  https://ift.tt/2uRwc1r  johnangel1977"
983827477595344896,2018-04-10,18:02:03,"Tesla has Supercharger stations all over the map, but the largest, most luxurious one sits in the middle of a folksy California town — take a look inside (TSLA)  https://ift.tt/2uRwc1r "
983827031778619392,2018-04-10,18:00:17,"Tesla has Supercharger stations all over the map, but the largest, most luxurious one sits in the middle of a folksy California town — take a look inside (TSLA)...  http://uk.businessinsider.com/tesla-supercharger-map-2018-locations-details-2018-4 … pic.twitter.com/P5rTe8MhCL"
983822778913533953,2018-04-10,17:43:23,Tesla Price Target Cut On Model 3 Production Concerns  https://www.investors.com/news/technology/tesla-price-target-cut-model-3-production/ … $TSLA
983822026354896897,2018-04-10,17:40:24,Tesla $TSLA Rating Reiterated by Robert W. Baird  http://americanbankingnews.com/?p=6345643  #stocks
983821879097032704,2018-04-10,17:39:49,$TSLA  https://twitter.com/hoonable/status ... Tesla’s logistics job description aims to handle 1 mil VINs per year.  pic.twitter.com/MUdsRjnSDO
983821579342761987,2018-04-10,17:38:37,$TSLA  https://mobile.twitter.com/hoonable/status/983791230097199104?s=21 … Tesla’s logistics job description aims to handle 1 mil VINs per year.  pic.twitter.com/L6CF0cBet2
983820174187876352,2018-04-10,17:33:02,How Is SolarCity Fitting in With Tesla Now? $TSLA $SCTY  https://www.thestreet.com/investing/stocks/how-is-solarcity-fitting-in-with-tesla-inc-now--14551199 … via @TheStreet
983819943727611904,2018-04-10,17:32:07,$TSLA Elon Musk calls out Goldman Sachs after negative report on Tesla: 'Place your bets'  https://ift.tt/2v9gqyK 
983819872839675905,2018-04-10,17:31:50,Tesla (TSLA) stock rises as China’s President opens door for factory ownership and lower import duties  https://electrek.co/2018/04/10/tesla-tsla-stock-rise-china-factory-import-duties/ … #news #feedly
983819332198248449,2018-04-10,17:29:41,"Tesla's Big Bill Coming Due For Purchased Property And Equipment - Tesla, Inc. (NASDAQ:TSLA) | Seeking Alpha >>>  https://dh3p7.app.goo.gl/XrwF  #iShortener"
983818063287144448,2018-04-10,17:24:39,Traders Sell Tesla $TSLA on Strength Following Insider Selling  http://zpr.io/n9XBT 
983817913890164736,2018-04-10,17:24:03,BP to Store Clean Power With Tesla Battery at U.S. Wind Farm  https://bloom.bg/2qmXk2R  Big oil goes wind + battery. Times have changed. #Tesla #TSLA #windenergy #batteries #storagetech #renewables #sustainability #bigoil
983817843098685440,2018-04-10,17:23:46,Investors Sell Tesla $TSLA on Strength After Insider Selling   http://theenterpriseleader.com/?p=554352 
983817354734907392,2018-04-10,17:21:50,i think users will follow @elonmusk and @WhatsApp founders in #DeleteFacebook ..lets all buy @Tesla $tsla  https://twitter.com/GerberKawasaki/status/983813784820051969 …
983817273675796481,2018-04-10,17:21:31,Teletubbies live show in Reading could be huge for automakers....but especially Tesla $TSLA.   https://www.inyourarea.co.uk/news/how-to-get-tickets-for-teletubbies-live-in-reading/ …
983816608308187136,2018-04-10,17:18:52,Poor log truck safety record could be huge for automakers....but especially Tesla $TSLA.    http://kcby.com/news/local/driver-injured-when-log-truck-crashes-off-mountain-road …
983816177377054722,2018-04-10,17:17:09,Online exams to obtain driving license could be huge for automakers....but especially Tesla $TSLA.   http://www.dailymirror.lk/article/Online-exams-to-obtain-driving-license-from-May--148515.html …
983815942302908416,2018-04-10,17:16:13,Tesla Inc  Reiterated Rating by Goldman Sachs (Ranked 31st) to Sell with $195PT $TSLA #TSLA  http://www.firsttomarkets.com/FTMMobile/#/stock/749 …
983815608700735488,2018-04-10,17:14:54,Proposed changes to car parking charges in East Devon could be huge for automakers....but especially Tesla $TSLA.  https://www.devonlive.com/news/devon-news/proposed-changes-car-parking-charges-1441343#ICID=sharebar_twitter …
983814809513676802,2018-04-10,17:11:43,We touched base with #Tesloop. They reported the capacity on the Li-on #batteries on the 2 .@Tesla Model X's after 260K mils is an incredible 88% (a 4.6% loss/100K mi;es)! One more reason #Tesloop loves their #TSLA's. .@Automotive_News .@Autoline .@WSJautos .@WardsAuto pic.twitter.com/RRtqDomTEQ
983814775950934018,2018-04-10,17:11:35,New roads in India could be huge for automakers....but especially Tesla $TSLA.  https://www.bloomberg.com/news/articles/2018-03-28/breakneck-pace-of-india-road-awards-may-set-15-billion-record …
983813540564758528,2018-04-10,17:06:41,"Tesla is a big threat to many status quo interests, never underestimate the forces at work on that point alone, but also traders do see opportunity to raise panic and make a quick buck, all and all 2018 should be good for TSLA, could see 400 in 12 months"
983812811221602305,2018-04-10,17:03:47,"Tesla Motors Inc (TSLA) price at close, 2018-04-10, is 304.7."
983812763456765953,2018-04-10,17:03:35,"Tesla Motors Inc (TSLA) price at close, 2018-04-10, is 304.7."
983812754720124929,2018-04-10,17:03:33,"Tesla Motors Inc (TSLA) price at close, 2018-04-10, is 304.7. #teslamotors #tesla #stocks #NASDAQ #elonmusk"
983812398892093440,2018-04-10,17:02:08,"Tesla Motors Inc (TSLA) price at close, 2018-04-10, is 304.7."
983809158712627200,2018-04-10,16:49:16,"Read why @vitaliyk with Contrarian Edge, and a Model 3 Tesla $TSLA consumer, is lacking confidence in profitability from the more affordable option of the car.  https://hubs.ly/H0bD19b0 "
983809021655187457,2018-04-10,16:48:43,My buddy got his #Tesla3 already. Waited in line 3/31/16 @ Palo Alto dealership. Got email to config on 2/28/18 “3-6 weeks later” on 3/28/18 car’s VIN was ready and then car in hands April 5th $TSLA #Tesla @elonmusk 👍🏽 pic.twitter.com/6ILpK0zpbO
983807211502800896,2018-04-10,16:41:32,"📰Published Previously | Tesla Inc (TSLA) – The Beginnings of a Downward Spiral? Although not entirely new territory for the electric car maker, the last few weeks have been quite the roller coas  https://hedgeaccordingly.com/2018/04/tesla-inc-tsla-the-beginnings-of-a-downward-spiral.html?utm_source=ReviveOldPost&utm_medium=social&utm_campaign=ReviveOldPost …"
983806397115781121,2018-04-10,16:38:17,"Tesla already has a ton in China with a fast improving charging infrastructure. Now that the cars could be WAY cheaper..they’d need to boost S/X production for sure, that could add 20k/year in demand and affordableish M3 through the roof....could double it. #tsla #tesla @elonmusk"
983804163619373056,2018-04-10,16:29:25,Tesla INC (Put) (TSLA) Stake Increased by Oz Management Lp -  https://djzplanet.com/2018/04/10/tesla-inc-put-tsla-stake-increased-by-oz-management-lp/ … via http://news.google.com 
983803686416625666,2018-04-10,16:27:31,$TSLA 💪🤖👍 #Tesla engineering car leaked picture shows what Autopilot sees live with settings for ‘Full Self-Driving’  https://electrek.co/2018/04/10/tesla-autopilot-engineering-car-leaked-picture-full-self-driving-settings/ …
983803066003673088,2018-04-10,16:25:03,$TSLA:  How Is SolarCity Fitting in With Tesla Now?:   https://www.StockNewsWires.com/tsla-how-is-solarcity-fitting-in-with-tesla-now/ …
983803058336550913,2018-04-10,16:25:01,$TSLA:  Why Tesla’s China Business Could Explode:   https://www.StockNewsWires.com/tsla-why-teslas-china-business-could-explode/ …
983803000086061056,2018-04-10,16:24:48,$TSLA FINDS BUYERS AT KEY SUPPORT LEVEL:  https://techniquant.com/reports/stock-tsla-daily-technical-report-for-2018-04-10/ … Sentiment: Neutral #TSLA #Tesla
983802088789561345,2018-04-10,16:21:10,$TSLA Elon Musk calls out Goldman Sachs after negative report on Tesla: 'Place your bets'
983800393791606784,2018-04-10,16:14:26,"How often do you ever see a ""SELL"" rating from Goldman Sachs? -  Still gloomy on Tesla $TSLA | Seeking Alpha  http://ow.ly/c36v30jqg0b "
983799939724726273,2018-04-10,16:12:38,Tesla (TSLA) stock rises as China’s President opens door for factory ownership and lower import duties  https://buff.ly/2qjOW4W 
983799651303227392,2018-04-10,16:11:29,"BP, Tesla to team up in battery storage venture for wind farm $BP $TSLA  http://www.seekingalpha.com/news/3344739 "
983798122127085568,2018-04-10,16:05:25,I’ll take Elon and American innovation any day! .....Elon Musk calls out Goldman Sachs after negative report on Tesla: 'Place your bets' $tsla  https://www.cnbc.com/2018/04/10/elon-musk-calls-out-goldman-sachs-after-negative-report-on-tesla.html …
983796300758974464,2018-04-10,15:58:10,$TSLA - nice work @elonmusk @GoldmanSachs is the WORST when it comes Tesla ratings credibility. I'm embarrassed for them  https://twitter.com/cnbc/status/983791396397166593 …
983794244967108608,2018-04-10,15:50:00,Tesla (TSLA) stock rises as China's President opens door for factory ownership and lower import ...   https://search.app.goo.gl/o17Gw   S
983792714964598785,2018-04-10,15:43:55,"TSLA(+4.5%)stabilizing above solid support:  https://lnkd.in/gHfZhii , after yesterday's downside reversal, close below $289.00 would take out Monday's low=Caution, $tsla, #tsla, Tesla  https://lnkd.in/gBQDsiw "
983792234477883394,2018-04-10,15:42:01,"$GM $F $TSLA $FCAU $VLKAY:  China Gets More Mileage From Recycled Auto Pledge; GM, Ford, Tesla Jump:   https://www.StockNewsWires.com/gm-f-tsla-fcau-vlkay-china-gets-more-mileage-from-recycled-auto-pledge-gm-ford-tesla-jump/ …"
983786891525918727,2018-04-10,15:20:47,"Exactly $tsla is competing v others with $10 Bill cash each in the bank. Multiple factories worldwide. Etc, etc. Tesla valuation today is nuts"
983786063180296192,2018-04-10,15:17:29,"Tesla (TSLA) Shareholder Criterion Capital Management Has Raised Holding; As Mcdonalds (MCD) Market Valuation Declined, Transamerica Financial Advisors Increased by $1.80 Million Its Holdi..."
983786054812495872,2018-04-10,15:17:27,"Tesla has Supercharger stations all over the map, but the largest one sits in the middle of a folksy California town — take a look inside (TSLA)  http://dlvr.it/QP5JNf  pic.twitter.com/7VFiJKrUlB"
983783701170540544,2018-04-10,15:08:06,Elon Musk reveals that Tesla's dual-motor Model 3 will arrive in July (TSLA) | #Stockstowatch #Tesla #Teslamodel3 |  http://bit.ly/2qnd3Ps  pic.twitter.com/odrK8QgrO4
983782671947042816,2018-04-10,15:04:01,"@ben_levisohn of @barronsonline uses Sentieo data in ""Lessons from Tesla's Tumble""  https://buff.ly/2qhSJQ2  #Tesla $TSLA  pic.twitter.com/LM90SZdsuX"
983782358816964608,2018-04-10,15:02:46,"Tesla's search for talent shifts into high gear. Engineering job openings at $TSLA grew to 865 in Q1 2018, an uptick of 243% compared to the same period last year:  https://www.linkedin.com/pulse/can-tesla-win-talent-war-engineers-job-moves-apple-slack-tech/ …"
983782303422791680,2018-04-10,15:02:33,"Tesla, Inc. (NASDAQ:TSLA) Stock Consolidating - Live Trading News  http://bit.ly/2GRCtvv  via @livetradingnews"
983781540562845696,2018-04-10,14:59:31,Tesla Inc (TSLA): The Beginnings of a Downward Spiral?  http://dlvr.it/QP5C0Y  $$ pic.twitter.com/Dit0NHjmDE
983781438553116677,2018-04-10,14:59:07,"BP, Tesla to team up in battery storage venture for wind farm  https://seekingalpha.com/news/3344739-bp-tesla-team-battery-storage-venture-wind-farm?source=tweet … $BP $TSLA"
983779272132366342,2018-04-10,14:50:30,everyone should follow @elonmusk and @WhatsApp and #DeleteFacebook $FB and BUY $TSLA @Tesla i believe in @elonmusk https://twitter.com/GerberKawasaki/status/983777325308231681 …
983777648991125506,2018-04-10,14:44:03,"Waiting for the $35K ""variant"" that doesn't exist.   $tsla $TSLAQ"
983777104578928642,2018-04-10,14:41:54,That is correct.  There are not.  If you study the current conversion rate ($TSLA $TSLAQ stated it was 30% ) and the deposit reported (artificially inflated for Q1 by 2500 payments for cars with no real VIN yet the conclusion is cancelations are abundant
983776772788383744,2018-04-10,14:40:34,Elon Musk Just Responded to China's Huge Move On Tesla Imports - Inverse $tsla  https://apple.news/AyeTQwAmsTYSnIN5WgVtRgA …
983776554240032768,2018-04-10,14:39:42,Tesla deploying Powerpacks at a BP wind farm - Electrek $tsla  https://apple.news/AlB1AhaUoTd6oYBEw88oIIA …
983775912041893888,2018-04-10,14:37:09,"Elon Musk reveals that Tesla's dual-motor Model 3 will arrive in July (TSLA): I'd be warmer if they leased the battery, did swaps at filling stations!  https://aol.it/2HaNRG9  via @AOL"
983774146688618496,2018-04-10,14:30:08,#Tesla (TSLA) stock rises as #China’s President opens door for factory ownership and lower import duties https://twitter.com/ElectrekCo/status/983646553238851584 …
983774111754309634,2018-04-10,14:30:00,Still waiting for #DavidTamberrino to lose his job. #GoldmanSachs lacks foresight for keeping this dumb dude on $TSLA coverage. Today's bearish outpouring are akin to Hitler's last days in the bunker--maniacal desperation/delusions of grandeur. #Tesla #ElonMusk #WallStreet
983773823567671296,2018-04-10,14:28:51,Another advantage for Tesla is gas prices have shot up. Costs almost $4 a gallon now. I hope to never go to a gas station again. #Model3 #Tesla $TSLA
983772882093395969,2018-04-10,14:25:07,Goldman Sachs still gloomy on Tesla  https://seekingalpha.com/news/3344696-goldman-sachs-still-gloomy-tesla?source=tweet … $TSLA
983772668041232385,2018-04-10,14:24:16,$MTSL Mer Tele Management  http://mtsint.com   All systems ready at $TYO Panasonic Tesla Manufacturer Partner $TSLA  https://panasonic.net/cns/office/products/pbx/solutions/3rdparty_program/ ….
983772332551372800,2018-04-10,14:22:56,"BP, Tesla to team up in battery storage venture for wind farm $BP $TSLA  http://www.seekingalpha.com/news/3344739 "
983770982090407936,2018-04-10,14:17:34,Tomorrow. 12:45 ET. Go to @CNNMoney to watch Markets Now LIVE from the NYSE. @maggielake will talk to Jim Chanos about why he's shorting Tesla and she'll also discuss the latest testimony from Mark Zuckerberg. $TSLA $FB  http://money.cnn.com/2018/04/10/investing/jim-chanos-markets-now/index.html … http://money.cnn.com/investing/markets-now/?iid=EL …
983770382934134786,2018-04-10,14:15:11,"BP, Tesla to team up in battery storage venture for wind farm  https://seekingalpha.com/news/3344739-bp-tesla-team-battery-storage-venture-wind-farm?source=tweet … $BP $TSLA"
983770290302996481,2018-04-10,14:14:49,Tb Alternative Assets LTD Has Increased Its Tesla Tsla Us (TSLA) Position by $4.54 Million; 3G Capital Partners LP Trimmed Its Position in Berry Global Group (BERY) by $5.80 Million as Market Valuation Declin...
983769587291484160,2018-04-10,14:12:01,$TSLA $GM $F:  Tesla Price Target Cut On Model 3 Production Concerns:   https://www.StockNewsWires.com/tsla-gm-f-tesla-price-target-cut-on-model-3-production-concerns/ …
983768597335085057,2018-04-10,14:08:05,"You seem to be missing the point about the alleged 'unlimited demand'.  In fact, it doesn't exist, the eBay auctions reflect that.  $tsla"
983767633693638657,2018-04-10,14:04:16,#TSLA $TSLA #Tesla is up by 5.38%  https://wallmine.com/nasdaq/tsla?utm_source=twitter … pic.twitter.com/cvVzMFcYSC
983766686049427457,2018-04-10,14:00:30,"RT PerfuShop ""Tesla Motors Inc (TSLA) stock rose by 5.2882%! Currently priced at 304.9777. #Perfushop  pic.twitter.com/t6wDKIU0XF"""
983765851252895744,2018-04-10,13:57:11,Tesla Motors Inc (TSLA) stock rose by 5.2882%! Currently priced at 304.9777. #Perfushop pic.twitter.com/ba9UPK4RD5
983765726287859714,2018-04-10,13:56:41,Retweeted Steve (@TeslaTouring):  Tesla's Model 3 is loaded with impressive features — but one stands out above the rest (TSLA)  http://www.pulse.com.gh/bi/finance/teslas-model-3-is-loaded-with-impressive-features-but-one-stands-out-above-the-rest-tsla-id8222886.html …  http://www.pulse.com.gh/bi/finance/teslas-model-3-is-loaded-with-impressive-features-but-one-stands-out-above-the-rest-tsla-id8222886.html … http://www.pulse.com.gh/bi/finance/teslas-model-3-is-loaded-with-impressive-features-but-one-stands-out-above-the-rest-tsla-id8222886.html …
