id,date,time,tweet
985300783695527936,2018-04-14,19:36:27,Anyone interested in Elon Musk or Tesla $TSLA should read this thread.  https://twitter.com/markbspiegel/status/985227900558376960 …
985300560176959488,2018-04-14,19:35:34,"New York is moving more aggressively towards an #electricvehicle future, read here:  http://ow.ly/HQOn30juEK8  $TSLA #TeslaMotors #Tesla #ElonMusk"
985299373117538304,2018-04-14,19:30:51,"73 page $TSLA Securities Lawsuit OUT. Tesla is toast, in my view. Suit a bomb shell under 'succes narrative'  of lies by @elonmusk pumping stock. Huge damages inevitable. SEC to take action? Accountants should worry. Zero chance new capital. Insiders talk. Thank Mark Spiegel. https://twitter.com/markbspiegel/status/985227900558376960 …"
985293698375323648,2018-04-14,19:08:18,these people are so low class. Imagine a @tesla employee going so low or stupid to do it openly like that . $tsla
985293210456031232,2018-04-14,19:06:21,Ok this is weird AF an actual GM employee is hating @tesla on twitter and short puts the stock this is too good. @elonmusk $tsla  pic.twitter.com/KtGlFz6vqp
985289790856876034,2018-04-14,18:52:46,Between @SpaceX and @Tesla i'm pretty sure @elonmusk could probably write a book with quotes from employees and outsiders telling him something is impossible to do in a certain timeframe or ever. $tsla haters will never learn.
985287486220910592,2018-04-14,18:43:37,"It’s amazing how @elonmusk who is running a bankrupt @Tesla and clearly fooling the investors by missing all the previous estimates, and will clearly still miss his call of $tsla being cash flow positive in Q3, is still not being investigated"
985286083788361729,2018-04-14,18:38:02,"Musk says Tesla will be profitable around 3rd qtr  http://bit.ly/2HewXXl  Promises, promises. Production volume for Model 3 currently less than half what was promised for almost a year ago. Why is this credible? #Tesla #TSLA #Model3 #shareprice #cashflow #profitability pic.twitter.com/3qFl982AHO"
985285351492104192,2018-04-14,18:35:08,"Finance: Tesla won't formally cooperate with the NTSB on fatal Autopilot investigation (TSLA)   Tesla has withdrawn from an investigation ""party agreement"" with National Transportation Safety Board, according to...  https://is.gd/tfpkJN  pic.twitter.com/lHf4o6pNBz"
985284892735913984,2018-04-14,18:33:18,"$TSLAQ : “Tesla is a complete fraud! Elon is a criminal! $TSLA IS A ZERO!! Gap down $100 tomorrow!”  Reality: $TSLAQ is nervous the #Model3 will soon become the best selling entry level luxury sedan beating the Audi A3, Audi A4, BMW 3 series, Mercedes Benz C-class, etc. pic.twitter.com/xEqr1hW3Py"
985284831104897025,2018-04-14,18:33:04,"No, Panasonic owns the equipment and $TSLA has committed to buy so much production that it had to be carried on Tesla's books as a capitalized lease. As you're clearly too lazy to do any real research, I shall now mute you. Have a good weekend!"
985282256930516993,2018-04-14,18:22:50,Meanwhile I am still awaiting warranty replacement for a 2013 S85 battery that lost range precipitously and then died in December around 70k miles... #Tesla $TSLA  https://twitter.com/cleantechinv/status/985251880262602758 …
985280796910112768,2018-04-14,18:17:02,"Musk rules out capital raise in snarky tweet, Tesla shares rise  https://on.mktw.net/2vdyPL7  Hasn't met any production schedules or previous promises. Being ""cash flow +"" depends on getting a lot more Model 3s on road faster. #Tesla #TSLA #Model3 #shareprice #magicalthinking pic.twitter.com/sSHyjIFLR0"
985278734520512512,2018-04-14,18:08:50,"Great news! Tom Randall  @tsrandall says Tesla will soon be making 3000 Model 3s per week! He should know, he personally counts every vin! And he’s not even a Tesla employee! He counts out of the goodness of his heart! $TSLA TSLAQ  https://www.bloomberg.com/graphics/2018-tesla-tracker/ …"
985276842197311488,2018-04-14,18:01:19,"You're clueless, pal. Read the SEC filings. Panasonic owns the Gigafactory equipment and sells $TSLA the batteries at a nice mark-up. Tesla may very well now be the high-cost buyer in the industry, considering all the cheap capacity coming on-lin in China."
985276519047139334,2018-04-14,18:00:02,"ICYMI: @NTSB removes Tesla from autopilot crash investigation as Tesla blames driver, withdraws formal cooperation. More from @theflynews $TSLA  https://bit.ly/2JIQOMH "
985275560078163968,2018-04-14,17:56:13,Tesla won't formally cooperate with the #NTSB on fatal Autopilot crash investigation (TSLA) - #Yahoo News :  http://fat.ly/3wLod 
985273912354160640,2018-04-14,17:49:40,"Let's agree 2 disagree. U've chosen 2 miss the point. .@Telsa invested in #robots, #Parts #storage , Model 3 mfg line, #Gigafactory & #Supercharging #Stations. Look @ #TSLA #Balance #Sheet.  They sell a Model 3 4 $50K - cost, $37.5K. .@WardsAuto .@KelleyBlueBook .@ECarsReport pic.twitter.com/vgGhhQPDBz"
985260715102621702,2018-04-14,16:57:14,Oh brother... the Gigafactory ist truly Tesla’s moat. $TSLA  pic.twitter.com/tRSP4mLAuv
985258170875564033,2018-04-14,16:47:07,Tesla needs to pull back on Autopilot before it's too late (TSLA)  https://finance.yahoo.com/news/tesla-needs-pull-back-autopilot-125700893.html …
985256074189164545,2018-04-14,16:38:47,Some allegations definitely not substantiated at this point. But I would argue that the general idea that Tesla dramatically overhyped its capabilities and injured shareholders doing so is going to age very well.$TSLA
985245579474325506,2018-04-14,15:57:05,One thing this document has wrong imo is 2017 capex for model 3. When you read the statements Tesla has been playing a clever game in mentioning capex and model 3 in the same sentence but they don't really say it's capex FOR model 3.   Most $TSLA model 3 capex is yet to come!!!  https://twitter.com/markbspiegel/status/985227900558376960 …
985245467079561216,2018-04-14,15:56:38,$TSLA batteries have more capacity than nameplate so that degradation can appear to be softened.  We saw this when Tesla opened “full battery capacity” during hurricane #Irma  https://www.washingtonpost.com/news/innovations/wp/2017/09/11/as-hurricane-irma-bore-down-tesla-gave-some-florida-drivers-more-battery-juice-heres-why-thats-a-big-deal/?noredirect=on&utm_term=.c174a39abb53 … https://twitter.com/teslacharts/status/985236222963482624 …
985244075195621376,2018-04-14,15:51:07,"As Tesla INC (Put) (TSLA) Market Value Declined, Moon Capital Management LP Has Decreased ...  http://bit.ly/2qvqqNe "
985243799478775808,2018-04-14,15:50:01,BP Installing Tesla Battery At US Wind Farm To Store Clean Power  https://bloom.bg/2qmXk2R  Big oil installs wind + battery. Times have changed. #Tesla #TSLA #windenergy #batteries #storagetech #renewables #sustainability #bigoil pic.twitter.com/4GePWpLqMj
985230967085379584,2018-04-14,14:59:01,#ElonMusk doubles down on his controversial April Fools' joke with an #InstagramPhoto of a Tesla-branded tequila bottle (TSLA) 🍾 🖼  https://read.bi/2Jj1qBD  via via @matousekmark pic.twitter.com/rksCUghL0Y
985228351072858112,2018-04-14,14:48:38,I hope Tesla turns around now that Elon is spending time at the factory & will recalibrate robotics assembly line to exceed production quotas;  If they nail it right it may rise back to 350 & pass 400 w/o having to borrow so many folks have hopes for TSLA til Apple car crush 2021
985224946547752960,2018-04-14,14:35:06,Tesla Inc (TSLA) In Hot Water With #NTSB Following Comments -  http://StockNews.com  (blog) :  http://fat.ly/4cIS4 
985223392000278528,2018-04-14,14:28:55,$TSLA $TSLAQ I wonder what the #teslafaithful have to say... #tesla  https://twitter.com/Andreas_Hopf/status/985078947963645952 …
985219211042619394,2018-04-14,14:12:19,"First Republic Bank (FRC) Holder First American Bank Decreased Stake as Valuation Rose; As Tesla (TSLA) Market Valuation Declined, Shareholder J Goldman & Company LP Has Trimmed Holding by $3.45 Milli..."
985216124601106432,2018-04-14,14:00:03,Tesla: Avoid at all Cost or Time to Invest.  http://goo.gl/9YFkaA  $TSLA #Investments #Investing #Tesla #Stock #FinancialEducation #InvestmentEducation pic.twitter.com/iGIipCQBvL
985213114668011520,2018-04-14,13:48:05,What In The World Is Tesla Doing? Bizarre Manufacturing Processes Produce Massive Cash Burn:  https://www.forbes.com/sites/jimcollins/2018/04/13/what-in-the-world-is-tesla-doing-bizarre-manufacturing-processes-produce-massive-cash-burn/ … by @PortfolioGuru $TSLA  pic.twitter.com/RuCXUijqji
985210583375998976,2018-04-14,13:38:02,"What the phrase for the exact opposite of just-in-time manufacturing ? Tesla is pioneering a new approach~never-in-time re-manufacturing ?  Of course it’s hard, struggling with it is to be expected~no big deal.  Lying about it~that’s a big deal.  (disclosure: short $tsla)  https://twitter.com/cnbc/status/984870917795975168 …"
985210548215275520,2018-04-14,13:37:53,"Lakeview Capital Partners Boosted At&T (T) Holding by $343,026; As Tesla (Put) (TSLA) Market Value Declined, Holder 683 Capital Management Upped Positi..."
985210307613286400,2018-04-14,13:36:56,Tesla’s Musk says excessive automation was 'a mistake. my mistake'  https://seekingalpha.com/news/3345638-tesla-s-musk-says-excessive-automation-a-mistake-mistake?source=tweet … $TSLA
985210222393352193,2018-04-14,13:36:35,"Tesla is making 4000 cars a week, TODAY. With battery prices non of you idiots can imagine. So yes, as battery prices crash down and investmets subside profitability is a reality. At least quit twitter, you idiots are just getting your short trade more crowded. $tsla"
985209828120424449,2018-04-14,13:35:01,Musk Admits Automation At Tesla Factory Was a Bad Idea  http://bit.ly/2IXvGBc  #robotics #automation #humanlabor #Tesla #TSLA  pic.twitter.com/kbbPJBZxY0
985206572476493824,2018-04-14,13:22:05,"$tsla holds me with a macabre fascination. Once upon a time in Ireland (pre 2008), we were promised the economy would have a ""soft landing"". In reality it was accelerating towards the ground. And then we had a lost decade. Seen it before, I fear #Tesla is not long for this world."
985206019340021760,2018-04-14,13:19:53,$TSLA paid in full 3 weeks ago then @Tesla cancels delivery and will not let the customer know the status of the car or when they can expect delivery.  #TheTeslaExperience https://twitter.com/drbaltz/status/983703211524620288 …
985205699142672384,2018-04-14,13:18:37,"Norway is the #electricvehicle leader worldwide, here's why:  http://ow.ly/IMLS30juwt4  $TSLA #TeslaMotors #Tesla #ElonMusk"
985195906642440193,2018-04-14,12:39:42,"PUBLISHERS NOTE/ +100  #BloombergModel3BuildTracker  04.14.18  @Tesla #Automotive Division #TeslaModel3 #Model3 #ElectricFueledVehicle:#EV #ZEV #ElectricCar An @ElonMusk Co.  Sixteen Thousand And Ninty Five.   16,095+ Total Cars / 2,395+ Wk   https://www.bloomberg.com/graphics/2018-tesla-tracker/ … $TSLA  pic.twitter.com/P6Bq6IRnDw"
985192439626567680,2018-04-14,12:25:56,­­The CEO effect: The difference between Tesla Motors and Litecoin #tsla #ltc #litecoin #ElonMusk Steemit https://steemit.com/bitcoin/@leoj/the-ceo-effect-the-difference-between-tesla-motors-and-litecoin …
985189451612807170,2018-04-14,12:14:03,"Is he referring to ""the data"" that (according to $TSLA ) had thousands of cars passing right by the exact spot that had that guy's Autopilot drive him into a construction barrier?  THAT data? (Tesla's ""data"" is another myth of bullshit from Subsidy Fraud-Boy. Ask an ex-engineer.)  https://twitter.com/krmarko/status/985188343142060032 …"
985188343142060032,2018-04-14,12:09:39,"If Tesla goes belly up, its data might end up as valuable as its software and battery technology. HT @LoupVentures $TSLA  pic.twitter.com/oqoneFmDkS"
985187189175865344,2018-04-14,12:05:04,Tesla starts installing solar roofs in California: When can the rest of us get one?  http://bit.ly/2GI8XfL  #Tesla #TSLA #solarroof #solar #renewables #cleanenergy pic.twitter.com/aBGBb9KwOk
985185921850138625,2018-04-14,12:00:02,Tesla needs to pull back on Autopilot before it&#039;s too late (TSLA.  http://darkhelmet.midrehov.com/r.php?p=8862 
985181700589346817,2018-04-14,11:43:15,#SaturdayMorning Leaked Emails Reveal How Tesla Silences Bad Public Relations. #Bribed ? $TSLA  https://cmun.it/pevlvs 
985181385060122626,2018-04-14,11:42:00,"$TSLA If #Tesla Raises Capital or is Not Free Cash Flow Positive This Year, the SEC Should Go After Elon Musk  https://www.zerohedge.com/news/2018-04-13/if-tesla-raises-capital-or-not-free-cash-flow-positive-year-sec-should-go-after … $SPY $GLD $SLV $DIA $DJIA $IWM $TLT $EEM #stockmarket #commodities #investing #finance #stocks #gold #silver #bonds #bitcoin #cryptocurrency"
985180926845087745,2018-04-14,11:40:11,Tesla needs to pull back on Autopilot before it's too late (TSLA)  https://goo.gl/fb/D6J3Q9 
985180433632694272,2018-04-14,11:38:13,Tesla (Put) (TSLA) Shareholder Moon Capital Management LP Has Decreased Its Stake by $31.10 Million as Share Price Declined; Raytheon Co (RTN) Holder Fukoku Mutual Life Insurance Company Cut Its Holding as Stock Price Ro...
985179658831441920,2018-04-14,11:35:09,Elon Musk is now confident that Tesla (TSLA) will turn a profit during the second half of the year  https://buff.ly/2qtc0xj  #EMHiveMind
985173887171391488,2018-04-14,11:12:13,@Tesla could buy @GM's Ohio plant for #ModelY production $TSLA $GM http://money.cnn.com/2018/04/13/news/companies/gm-job-cuts/index.html …
985172301665710080,2018-04-14,11:05:54,“Fully paid for 3 weeks...” Nice padding for the $TSLA customer deposit number at Q1 end.  Unfortunately you are a pawn in a larger game here.
985168002327998464,2018-04-14,10:48:49,"$TSLA body shops, paint shops, & gen assy lines cost 2.5x industry avg & prod 25% # of cars. Also $TSLA uses multiple orders of magnitudes more associates on per car basis. There is only 1 way for Tesla to successfully make cars cost effectively: fire Elon Musk.  He is an idiot.  https://twitter.com/andreas_hopf/status/985078947963645952 …"
985167166948261890,2018-04-14,10:45:30,Tesla Motors Inc (TSLA) Executive Talks On Australian Renewable Energy Industry |  http://bit.ly/2EKEec5  #renewable#energy
985166420919988226,2018-04-14,10:42:32,Tesla needs to pull back on Autopilot before it's too late (TSLA)  http://dlvr.it/QPWtgf  pic.twitter.com/1thlWJeQv6
985164496837709825,2018-04-14,10:34:54,@Tesla Model 3: “Honda Civic volume at a BMW EBIT margin.”  Thank you @trentaeady for an incredible article $TSLA  https://seekingalpha.com/article/4162910-10-months-tesla-prove-critics-wrong-model-3-math …
985159489362935808,2018-04-14,10:15:00,Tesla needs to pull back on Autopilot before it's too late (TSLA)  http://dlvr.it/QPWmcZ  pic.twitter.com/QfVznlgmhV
985158169017049088,2018-04-14,10:09:45,"GR8 interview with #BobLutz 11' 17"" long. Where is he wrong on .@Tesla? He states #TSLA loses money on every #vehicle (sells 4 $100K & costs $116K) Not the case. #gross #MARGIN on S's & X's R >20%. Model 3 willB 25%. .@Autoline .@InsideEVs .@ElectrekCo .@FT .@AmazingChevVolt pic.twitter.com/rmZ1QdNdIp"
985157453489647617,2018-04-14,10:06:54,[Zicutake] Tesla needs to pull back on Autopilot before it's too late (TSLA)  https://goo.gl/fb/MF4Syy 
985157142092091392,2018-04-14,10:05:40,Ctc Lowered Its Stake in Tesla (TSLA) by $11.95 Million; Crystal Rock Capital Management Has Lowered Its Facebook (FB) Position as Market Value Declin...
985156990845497345,2018-04-14,10:05:04,Tesla $TSLA Will be Profitable and Cash Flow Positive in Q3 and Q4 - Musk  https://www.streetinsider.com/dr/news.php?id=14052261 …
985155554816307202,2018-04-14,09:59:22,Tesla needs to pull back on Autopilot before it's too late (TSLA)  https://goo.gl/fb/v5vBu7 
985154325465923584,2018-04-14,09:54:29,"$TSLA Significant acceleration in invites has followed a jump in NHTSA VIN registrations. Next up: Higher rate of VIN assignments in late April, followed up a step change in deliveries in May and June. @Tesla is on track for 5,000 weekly production by June and deliveries by July.  https://twitter.com/GerberKawasaki/status/984922174191353856 …"
985152931744960512,2018-04-14,09:48:56,"$TSLA Following ""fair future at tesla"" on Facebook (run by UAW). Lots of overtime at Fremont lately, workers being ""voluntold"" to work long hours and weekends. Unclear if they are getting paid properly."
985152711883538432,2018-04-14,09:48:04,Tesla needs to pull back on Autopilot before it's too late (TSLA): - Tesla has been…  https://goo.gl/fb/RVqTWR 
985150874472169472,2018-04-14,09:40:46,Tesla needs to pull back on Autopilot before it's too late (TSLA)  http://www.businessinsider.com/tesla-autopilot-strategy-is-a-mistake-2018-4 …
985150797770969089,2018-04-14,09:40:28,Tesla needs to pull back on Autopilot before it's too late (TSLA)  http://dlvr.it/QPWd0n  pic.twitter.com/291OYhSVru
985148245423751170,2018-04-14,09:30:19,"$TSLA more babbling from EV con artist Musk. Tesla relied on too many robots to build the Model 3, Elon Musk says  https://a.msn.com/r/2/AAvQS4T?m=en-us&a=0 … pic.twitter.com/AzrDtSsdZy"
985147685689839616,2018-04-14,09:28:06,Tesla needs to pull back on Autopilot before it's too late (TSLA)  http://cyberageonline.com/tesla-needs-to-pull-back-on-autopilot-before-its-too-late-tsla/ … pic.twitter.com/V9Wt5qP4c4
985147673014603776,2018-04-14,09:28:03,Tesla needs to pull back on Autopilot before it's too late (TSLA)  http://cyberageonline.com/tesla-needs-to-pull-back-on-autopilot-before-its-too-late-tsla/ … pic.twitter.com/hI6SfTOG0e
985147667847131136,2018-04-14,09:28:01,#Tesla needs to pull back on Autopilot before it's too late (TSLA)  http://feedproxy.google.com/~r/businessinsider/~3/NNHmcbRNrpU/tesla-autopilot-strategy-is-a-mistake-2018-4 … pic.twitter.com/EIRCVbf2Vt
985147660481986560,2018-04-14,09:28:00,Tesla needs to pull back on Autopilot before it's too late (TSLA)  http://cyberageonline.com/tesla-needs-to-pull-back-on-autopilot-before-its-too-late-tsla/ … pic.twitter.com/HLly6THfLZ
985147645982396422,2018-04-14,09:27:56,Tesla needs to pull back on Autopilot before it's too late (TSLA)  http://cyberageonline.com/tesla-needs-to-pull-back-on-autopilot-before-its-too-late-tsla/ … pic.twitter.com/lXsbocpPEg
985147632669650946,2018-04-14,09:27:53,Tesla needs to pull back on Autopilot before it's too late (TSLA)  http://cyberageonline.com/tesla-needs-to-pull-back-on-autopilot-before-its-too-late-tsla/ … pic.twitter.com/tD8BbFOT7S
985145448234176512,2018-04-14,09:19:12,Tesla needs to pull back on Autopilot before it's too late (TSLA):  https://ift.tt/2ELOMaN  @SheikhMende #Dubai
985145429397573632,2018-04-14,09:19:08,"New post: ""Tesla needs to pull back on Autopilot before it's too late (TSLA)""  https://ift.tt/2EICSON "
985143927643754498,2018-04-14,09:13:10,Tesla needs to pull back on Autopilot before it's too late (TSLA)  pic.twitter.com/B5VNcwltwQ
985143431067586560,2018-04-14,09:11:11,Tesla needs to pull back on Autopilot before it's too late (TSLA)  https://ift.tt/2GXA6aq  Tesla's Autopilot system simply is not good enough to be worth the distraction from bigger concerns for the carmaker.  https://ift.tt/eA8V8J 
985143245666693120,2018-04-14,09:10:27,Tesla 50 billons dollars worth of golf carts. The bankruptcy will be a hoot $tsla
985143157703704576,2018-04-14,09:10:06,Tesla needs to pull back on Autopilot before it's too late (TSLA)  https://read.bi/2Hzs9JE 
985143002665574403,2018-04-14,09:09:29,10 Things To Know. Tesla needs to pull back on Autopilot before it's too late (TSLA)  https://ift.tt/2EICSON 
985142685303525382,2018-04-14,09:08:13,Tesla needs to pull back on Autopilot before it's too late (TSLA)  https://ift.tt/2EICSON  johnangel1977
985142679653769216,2018-04-14,09:08:12,Tesla needs to pull back on Autopilot before it's too late (TSLA)  https://ift.tt/2EICSON 
985142646166491136,2018-04-14,09:08:04,Tesla needs to pull back on Autopilot before it's too late (TSLA)  https://ift.tt/2EICSON 
985142567401439232,2018-04-14,09:07:45,Finance: Tesla needs to pull back on Autopilot before it’s too late (TSLA…  https://goo.gl/fb/7288jX  #Hisprideblog
985142028387438593,2018-04-14,09:05:37,Tesla needs to pull back on Autopilot before it's too late (TSLA)  http://uk.businessinsider.com/tesla-autopilot-strategy-is-a-mistake-2018-4 … pic.twitter.com/LdSfPKnAhq
985141944681684992,2018-04-14,09:05:17,Tesla needs to pull back on Autopilot before it's too late (TSLA)  https://read.bi/2HoJfw6  #tech #business #success pic.twitter.com/5mxRlu0g8T
985141711344193536,2018-04-14,09:04:21,Tesla needs to pull back on Autopilot before it's too late (TSLA)  https://read.bi/2Hz5CwB 
985141667715080192,2018-04-14,09:04:11,Tesla needs to pull back on Autopilot before it's too late (TSLA)  https://read.bi/2qwPIuI  pic.twitter.com/lWB4Fclx6J
985141284007530496,2018-04-14,09:02:39,Tesla needs to pull back on Autopilot before it's too late (TSLA)  https://ift.tt/2EICSON 
985141086745116674,2018-04-14,09:01:52,Tesla needs to pull back on Autopilot before it's too late (TSLA)  http://dlvr.it/QPWSnR  pic.twitter.com/gXJ9oDcvoe
985140958927949824,2018-04-14,09:01:22,Tesla needs to pull back on Autopilot before it's too late (TSLA)  https://ift.tt/2EICSON 
985131296304267264,2018-04-14,08:22:58,"You know what's hilarious about Musk's statement that the $TSLA factory needs more ""humans""? Tesla ALREADY employs 35 ""humans"" for each Model 3 it builds while Nissan uses 5 and Honda uses 3.5!  https://www.bloomberg.com/news/articles/2018-04-03/as-tesla-struggles-its-rivals-make-far-more-with-less … SO YEAH, HIRING MORE ""HUMANS""... THAT'S THE TICKET! $TSLAQ"
985128657671938048,2018-04-14,08:12:29,"Apriem Advisors Position in Tesla (TSLA) Has Decreased by $796,782 as Market Value Declined; Schweitzer (SWM) Holder Dean Capital Management Trimmed Its Stake by $3.28 Milli..."
985127235685318657,2018-04-14,08:06:50,"Whichever way you slice it, $TSLA is living on borrowed time. The work of @ElonBachman @markbspiegel @TeslaCharts and many others is far more valuable to investors than anything that comes out of either @elonmusk or @Tesla Caveat emptor  https://twitter.com/ElonBachman/status/984779915227811840 …"
985124813567152128,2018-04-14,07:57:12,The “alien dreadnought” has too many machines.... @elonmusk reveals why Tesla is going through a “production hell” with Model 3  http://bigthink.com/news/elon-musk-reveals-why-its-model-3-is-having-production-problems … $TSLA
985124266919198722,2018-04-14,07:55:02,"Check out the complete video footage from Gayle King's weeklong interview with #ElonMusk at the #Tesla factory, watch here:  http://ow.ly/QMTU30juous  $TSLA #TeslaMotors #TeslaModel3 #ElectricVehicle"
985123549974278144,2018-04-14,07:52:11,"Current inventory shows 70+ used Model S for sale on the $tsla site, ranging fromm $55k to $92k. We don't know what residual value was used for the leased cars, but we'll assume it was 60%. Tesla will now have a significant number of lease returns coming in 2018. /4"
985121289022115840,2018-04-14,07:43:12,"It's been assumed that Model S new car demand is lower, and I'll assume the same for the used market. $tsla recently announced no more refurbished CPO cars as well. So, what will happen to these 15k used cars showing up on Tesla lots?"
985120486324604928,2018-04-14,07:40:01,"Here's another albatross for $tsla in 2018. Lease returns.  They sold 50k cars in 2015, and for simplicity, we'll assume a 30% lease rate. Tesla doesn't release actual figures, so I could be far off.  This assumes that 15k Model S/X will get returned this year, mostly S. /1"
985115109931528192,2018-04-14,07:18:39,Tb Alternative Assets LTD Increased By $4.54 Million Its Tesla Tsla Us (TSLA) Holding; Foxhaven Asset Management LP Raised Its Priceline Grp (PCLN) Holdi...
985111481476886529,2018-04-14,07:04:14,"Analysts See $0.93 EPS for AptarGroup, Inc. (ATR); Bluefin Trading Has Lifted Tesla (Call) (TSLA) Positi..."
985101580478373888,2018-04-14,06:24:53,Novo (NVO) Holder Liberty Mutual Group Asset Management Raised Holding; Creative Planning Position in Tesla (TSLA) Raised by $13.93 Million as Stock Price Declin...
985086699008155651,2018-04-14,05:25:45,"$TSLA: Tesla Inc has lost a star, now a 0 star stock. ( https://stockflare.com/stock/TSLA.O )"
985083247393693696,2018-04-14,05:12:02,Tesla Inc -'I love Elon he s what the world needs more of ..' by john652   http://j.mp/2GX6k9S  LON:TSLA
985050659149041664,2018-04-14,03:02:33,"📰 Recap | .@ElonMusk Deletes SpaceX, #Tesla Facebook Pages $TSLA  https://hedgeaccordingly.com/2018/03/elonmusk-deletes-spacex-tesla-facebook-pages-tsla.html?utm_source=ReviveOldPost&utm_medium=social&utm_campaign=ReviveOldPost … #elonmusk #privacy #spacex"
985040463764705281,2018-04-14,02:22:02,Tesla INC (Put) (TSLA) Shareholder Barclays Plc Increased Its Stake  http://dlvr.it/QPV4jf 
985036475497672704,2018-04-14,02:06:11,Another video from inside #Tesla #Model3 assembly line 🚘🔋🔌  https://youtu.be/gka9_r-c_rw  @CBSThisMorning $TSLA #ElonMusk #EV #ElectricVehicle pic.twitter.com/hWI9xQucKQ
985020517475278848,2018-04-14,01:02:46,"Tesla ""Elon Musk admitted Friday that the automaker relied too heavily on robots to make its mass-market Model 3 electric vehicle and that so much automation contributed a production hell that has persisted for months."" ""He’s turning back to humans.""  http://j.mp/2qub77G  $TSLA"
985010978143326208,2018-04-14,00:24:52,We visited a Tesla showroom and a Mercedes-Benz dealership — here are the biggest differences between the two (TSLA)  http://google.com/newsstand/s/CBIwy52Gljg …
